,rating_ratingValue,rating_worstRating,rating_bestRating,rating_alternateName,creativeWork_author_name,creativeWork_datePublished,creativeWork_author_sameAs,claimReview_author_name,claimReview_author_url,claimReview_url,claimReview_claimReviewed,claimReview_datePublished,claimReview_source,claimReview_author,extra_body,extra_refered_links,extra_title,extra_tags,extra_entities_claimReview_claimReviewed,extra_entities_body,extra_entities_keywords,extra_entities_author,related_links
20,,,,Misattributed,Kim LaCapria,,,truthorfiction,https://www.truthorfiction.com/author/kim/,https://www.truthorfiction.com/finland-reindeer-reflective-paint-posts/,"A photograph Finland's reindeer with reflective antlers, painted to prevent roadway accidents.",2021-07-12,truthorfiction,,"Posted in Fact Checks, Viral ContentTagged art out of context, finland, finland reindeer reflective paint, instagram, misleading, viral facebook posts, viral images","https://www.truthorfiction.com/category/fact-checks/,https://www.truthorfiction.com/category/fact-checks/viral-content/,https://www.truthorfiction.com/tag/art-out-of-context/,https://www.truthorfiction.com/tag/finland/,https://www.truthorfiction.com/tag/finland-reindeer-reflective-paint/,https://www.truthorfiction.com/tag/instagram/,https://www.truthorfiction.com/tag/misleading/,https://www.truthorfiction.com/tag/viral-facebook-posts/,https://www.truthorfiction.com/tag/viral-images/",Finland Reindeer Reflective Paint Posts,"art out of context, finland, finland reindeer reflective paint, instagram, misleading, viral facebook posts, viral images",,,,,
21,,,,True,Kim LaCapria,,,truthorfiction,https://www.truthorfiction.com/author/kim/,https://www.truthorfiction.com/albert-einstein-lecturing-a-black-college-facebook-post/,"Albert Einstein spoke at Lincoln University in 1946, and said ""The separation of races is not a disease of colored people but a disease of white people. I do not intend to be quiet about it.""",2021-07-12,truthorfiction,,"Posted in Fact Checks, Viral ContentTagged albert einstein, albert einstein quotes, albert einstein racism, einstein lincoln university, lost images, viral facebook posts, viral images","https://www.truthorfiction.com/category/fact-checks/,https://www.truthorfiction.com/category/fact-checks/viral-content/,https://www.truthorfiction.com/tag/albert-einstein/,https://www.truthorfiction.com/tag/albert-einstein-quotes/,https://www.truthorfiction.com/tag/albert-einstein-racism/,https://www.truthorfiction.com/tag/einstein-lincoln-university/,https://www.truthorfiction.com/tag/lost-images/,https://www.truthorfiction.com/tag/viral-facebook-posts/,https://www.truthorfiction.com/tag/viral-images/",Albert Einstein Lecturing a Black College Facebook Post,"albert einstein, albert einstein quotes, albert einstein racism, einstein lincoln university, lost images, viral facebook posts, viral images",,,,,
22,,,,Decontextualized,Kim LaCapria,,,truthorfiction,https://www.truthorfiction.com/author/kim/,https://www.truthorfiction.com/ogx-dmdm-hydantoin-facebook-post/,"Consumers should avoid OGX products due to the presence of DMDM hydantoin, as the brand was sued over its formulations.",2021-07-09,truthorfiction,,"Posted in Fact Checks, Viral ContentTagged cosmetics, dmdm hydantoin, dmdm hydantoin ogx, does dmdm hydantoin cause hair loss, facebook warnings, formaldehyde, ogx, viral facebook posts","https://www.truthorfiction.com/category/fact-checks/,https://www.truthorfiction.com/category/fact-checks/viral-content/,https://www.truthorfiction.com/tag/cosmetics/,https://www.truthorfiction.com/tag/dmdm-hydantoin/,https://www.truthorfiction.com/tag/dmdm-hydantoin-ogx/,https://www.truthorfiction.com/tag/does-dmdm-hydantoin-cause-hair-loss/,https://www.truthorfiction.com/tag/facebook-warnings/,https://www.truthorfiction.com/tag/formaldehyde/,https://www.truthorfiction.com/tag/ogx/,https://www.truthorfiction.com/tag/viral-facebook-posts/",OGX DMDM Hydantoin Facebook Post,"cosmetics, dmdm hydantoin, dmdm hydantoin ogx, does dmdm hydantoin cause hair loss, facebook warnings, formaldehyde, ogx, viral facebook posts",,,,,
23,,,,Decontextualized,Kim LaCapria,,,truthorfiction,https://www.truthorfiction.com/author/kim/,https://www.truthorfiction.com/biden-admin-hhs-secretarys-absolutely-the-governments-business-vaccine-remarks/,"Health and Human Services Secretary Xavier Becerra said it is ""absolutely the government's business"" to know whether Americans are vaccinated.",2021-07-08,truthorfiction,,"Posted in Disinformation, Fact ChecksTagged becerra knocking on doors, biden vaccine, cnn, decontextualized, misleading, out of context, steven crowder, viral tweets","https://www.truthorfiction.com/category/fact-checks/disinformation/,https://www.truthorfiction.com/category/fact-checks/,https://www.truthorfiction.com/tag/becerra-knocking-on-doors/,https://www.truthorfiction.com/tag/biden-vaccine/,https://www.truthorfiction.com/tag/cnn/,https://www.truthorfiction.com/tag/decontextualized/,https://www.truthorfiction.com/tag/misleading/,https://www.truthorfiction.com/tag/out-of-context/,https://www.truthorfiction.com/tag/steven-crowder/,https://www.truthorfiction.com/tag/viral-tweets/",Biden Admin HHS Secretary’s ‘Absolutely the Government’s Business’...,"becerra knocking on doors, biden vaccine, cnn, decontextualized, misleading, out of context, steven crowder, viral tweets",,,,,
24,,,,Decontextualized,Kim LaCapria,,,truthorfiction,https://www.truthorfiction.com/author/kim/,https://www.truthorfiction.com/sf-gay-mens-chorus-convert-your-children-song/,"San Francisco's (SF) Gay Men's chorus literally sang they'll ""convert your children"" or are ""coming for your children.""",2021-07-08,truthorfiction,,"Posted in Disinformation, Fact ChecksTagged basically an outright lie, dinesh d'souza, rumble.com, sf gay mens chorus, sf gay mens chorus coming for your children, viral tweets","https://www.truthorfiction.com/category/fact-checks/disinformation/,https://www.truthorfiction.com/category/fact-checks/,https://www.truthorfiction.com/tag/basically-an-outright-lie/,https://www.truthorfiction.com/tag/dinesh-dsouza/,https://www.truthorfiction.com/tag/rumble-com/,https://www.truthorfiction.com/tag/sf-gay-mens-chorus/,https://www.truthorfiction.com/tag/sf-gay-mens-chorus-coming-for-your-children/,https://www.truthorfiction.com/tag/viral-tweets/",SF Gay Men’s Chorus ‘Convert Your Children’ Song,"basically an outright lie, dinesh d'souza, rumble.com, sf gay mens chorus, sf gay mens chorus coming for your children, viral tweets",,,,,
25,,,,True,Kim LaCapria,,,truthorfiction,https://www.truthorfiction.com/author/kim/,https://www.truthorfiction.com/darnella-fraziers-uncle-killed-by-minneapolis-police/,"Darnella Frazier, the girl who filmed the murder of George Floyd, disclosed via Facebook that her uncle was killed by Minneapolis police in July 2021.",2021-07-07,truthorfiction,,"Posted in Fact Checks, Viral ContentTagged darnella frazier uncle, darnella frazier uncle MPD, imgur, leneal frazier, minneapolis, Minneapolis Police Department, viral facebook posts","https://www.truthorfiction.com/category/fact-checks/,https://www.truthorfiction.com/category/fact-checks/viral-content/,https://www.truthorfiction.com/tag/darnella-frazier-uncle/,https://www.truthorfiction.com/tag/darnella-frazier-uncle-mpd/,https://www.truthorfiction.com/tag/imgur/,https://www.truthorfiction.com/tag/leneal-frazier/,https://www.truthorfiction.com/tag/minneapolis/,https://www.truthorfiction.com/tag/minneapolis-police-department/,https://www.truthorfiction.com/tag/viral-facebook-posts/",Darnella Frazier’s Uncle Killed by Minneapolis Police,"darnella frazier uncle, darnella frazier uncle MPD, imgur, leneal frazier, minneapolis, Minneapolis Police Department, viral facebook posts",,,,,
26,,,,Mixed,Kim LaCapria,,,truthorfiction,https://www.truthorfiction.com/author/kim/,https://www.truthorfiction.com/the-pledge-of-allegiance-was-adopted-in-1923-the-star-spangled-banner-was-adopted-in-1929/,"""The Pledge of Allegiance was adopted in 1923. The Star Spangled Banner was adopted in 1929. 'Under God' was added to the Pledge in 1954. 'In God We Trust' was added to our money in 1956. So no. They were not created by our Founding Fathers.""",2021-07-07,truthorfiction,,"Posted in Fact Checks, Viral ContentTagged founding fathers, history memes, in god we trust, in god we trust 1956, pledge of allegiance, pledge of allegiance 1923, star spangled banner, star spangled banner 1929, under god, under god 1954, viral facebook posts","https://www.truthorfiction.com/category/fact-checks/,https://www.truthorfiction.com/category/fact-checks/viral-content/,https://www.truthorfiction.com/tag/founding-fathers/,https://www.truthorfiction.com/tag/history-memes/,https://www.truthorfiction.com/tag/in-god-we-trust/,https://www.truthorfiction.com/tag/in-god-we-trust-1956/,https://www.truthorfiction.com/tag/pledge-of-allegiance/,https://www.truthorfiction.com/tag/pledge-of-allegiance-1923/,https://www.truthorfiction.com/tag/star-spangled-banner/,https://www.truthorfiction.com/tag/star-spangled-banner-1929/,https://www.truthorfiction.com/tag/under-god/,https://www.truthorfiction.com/tag/under-god-1954/,https://www.truthorfiction.com/tag/viral-facebook-posts/","The Pledge of Allegiance Was Adopted in 1923, the Star Spangled...","founding fathers, history memes, in god we trust, in god we trust 1956, pledge of allegiance, pledge of allegiance 1923, star spangled banner, star spangled banner 1929, under god, under god 1954, viral facebook posts",,,,,
27,,,,Not True,Arturo Garcia,,,truthorfiction,https://www.truthorfiction.com/author/art/,https://www.truthorfiction.com/shacarri-richardson-rebecca-washington-replacement/,"Sprinter Sha'Carri Richardson will be replaced by a Mormon athlete, Rebecca Washington, on the U.S. Olympic Team",2021-07-07,truthorfiction,,"Posted in Fact Checks, Viral ContentTagged 2021 Summer Olympics, marijuana, olympics, running, Sha'Carri Richardson, twitter","https://www.truthorfiction.com/category/fact-checks/,https://www.truthorfiction.com/category/fact-checks/viral-content/,https://www.truthorfiction.com/tag/2021-summer-olympics/,https://www.truthorfiction.com/tag/marijuana/,https://www.truthorfiction.com/tag/olympics/,https://www.truthorfiction.com/tag/running/,https://www.truthorfiction.com/tag/shacarri-richardson/,https://www.truthorfiction.com/tag/twitter/",Is Rebecca Washington Replacing Sha’Carri Richardson on the U.S...,"2021 Summer Olympics, marijuana, olympics, running, Sha'Carri Richardson, twitter",,,,,
28,,,,True,Kim LaCapria,,,truthorfiction,https://www.truthorfiction.com/author/kim/,https://www.truthorfiction.com/u-s-quietly-slips-out-of-afghanistan-in-dead-of-night-onion-story/,"In 2011, ten years before July 2021 news about the United States leaving Afghanistan in the dead of night, satirical outlet The Onion published a headline predicting it.",2021-07-06,truthorfiction,,"Posted in Fact Checks, Viral ContentTagged Afghanistan, associated press, not satire, ostension, satire, the onion, the onion 10 years ago AP today, US Quietly Slips Out Of Afghanistan In Dead Of Night, viral tweets","https://www.truthorfiction.com/category/fact-checks/,https://www.truthorfiction.com/category/fact-checks/viral-content/,https://www.truthorfiction.com/tag/afghanistan/,https://www.truthorfiction.com/tag/associated-press/,https://www.truthorfiction.com/tag/not-satire/,https://www.truthorfiction.com/tag/ostension/,https://www.truthorfiction.com/tag/satire/,https://www.truthorfiction.com/tag/the-onion/,https://www.truthorfiction.com/tag/the-onion-10-years-ago-ap-today/,https://www.truthorfiction.com/tag/us-quietly-slips-out-of-afghanistan-in-dead-of-night/,https://www.truthorfiction.com/tag/viral-tweets/",‘U.S. Quietly Slips Out Of Afghanistan In Dead Of Night’ Onion Story,"Afghanistan, associated press, not satire, ostension, satire, the onion, the onion 10 years ago AP today, US Quietly Slips Out Of Afghanistan In Dead Of Night, viral tweets",,,,,
29,,,,True,Kim LaCapria,,,truthorfiction,https://www.truthorfiction.com/author/kim/,https://www.truthorfiction.com/donald-rumsfeld-and-mount-misery/,"Former United States Secretary of Defense Donald Rumsfeld purchased Mount Misery, a house with a violent history.",2021-07-06,truthorfiction,,"Posted in Fact Checks, Viral ContentTagged donald rumsfeld, frederick douglass, mount misery, rachel maddow, rumsfeld mount misery, viral facebook posts, viral videos","https://www.truthorfiction.com/category/fact-checks/,https://www.truthorfiction.com/category/fact-checks/viral-content/,https://www.truthorfiction.com/tag/donald-rumsfeld/,https://www.truthorfiction.com/tag/frederick-douglass/,https://www.truthorfiction.com/tag/mount-misery/,https://www.truthorfiction.com/tag/rachel-maddow/,https://www.truthorfiction.com/tag/rumsfeld-mount-misery/,https://www.truthorfiction.com/tag/viral-facebook-posts/,https://www.truthorfiction.com/tag/viral-videos/",Donald Rumsfeld and Mount Misery,"donald rumsfeld, frederick douglass, mount misery, rachel maddow, rumsfeld mount misery, viral facebook posts, viral videos",,,,,
