,rating_ratingValue,rating_worstRating,rating_bestRating,rating_alternateName,creativeWork_author_name,creativeWork_datePublished,creativeWork_author_sameAs,claimReview_author_name,claimReview_author_url,claimReview_url,claimReview_claimReviewed,claimReview_datePublished,claimReview_source,claimReview_author,extra_body,extra_refered_links,extra_title,extra_tags,extra_entities_claimReview_claimReviewed,extra_entities_body,extra_entities_keywords,extra_entities_author,related_links
0,,,,True,Kim LaCapria,,,truthorfiction,https://www.truthorfiction.com/author/kim/,https://www.truthorfiction.com/china-received-8-months-of-rain-in-just-5-days-in-july-2021/,"""China received 8 months of rain in just 5 days.""",2021-07-27,truthorfiction,,"Posted in Fact Checks, Viral ContentTagged 1000 year climate event, china flooding 2021, extreme weather, floods in china 2021, how much rain did china get, viral facebook posts, zhengzhou flood 2021","https://www.truthorfiction.com/category/fact-checks/,https://www.truthorfiction.com/category/fact-checks/viral-content/,https://www.truthorfiction.com/tag/1000-year-climate-event/,https://www.truthorfiction.com/tag/china-flooding-2021/,https://www.truthorfiction.com/tag/extreme-weather/,https://www.truthorfiction.com/tag/floods-in-china-2021/,https://www.truthorfiction.com/tag/how-much-rain-did-china-get/,https://www.truthorfiction.com/tag/viral-facebook-posts/,https://www.truthorfiction.com/tag/zhengzhou-flood-2021/",‘China Received 8 Months of Rain in Just 5 Days’ in July 2021,"1000 year climate event, china flooding 2021, extreme weather, floods in china 2021, how much rain did china get, viral facebook posts, zhengzhou flood 2021",,,,,
1,,,,True,Kim LaCapria,,,truthorfiction,https://www.truthorfiction.com/author/kim/,https://www.truthorfiction.com/bics-martha-and-snoop-ad/,"Image shows a real advertisement for Bic lighters, featuring Snoop Dogg and Martha Stewart.",2021-07-27,truthorfiction,,"Posted in Entertainment, Fact ChecksTagged bic, bic martha and snoop, cannabis, cheerful nihilism, cheerful nihilism facebook, martha stewart, snoop dogg, viral facebook posts","https://www.truthorfiction.com/category/fact-checks/entertainment/,https://www.truthorfiction.com/category/fact-checks/,https://www.truthorfiction.com/tag/bic/,https://www.truthorfiction.com/tag/bic-martha-and-snoop/,https://www.truthorfiction.com/tag/cannabis/,https://www.truthorfiction.com/tag/cheerful-nihilism/,https://www.truthorfiction.com/tag/cheerful-nihilism-facebook/,https://www.truthorfiction.com/tag/martha-stewart/,https://www.truthorfiction.com/tag/snoop-dogg/,https://www.truthorfiction.com/tag/viral-facebook-posts/",Bic’s ‘Martha and Snoop’ Ad,"bic, bic martha and snoop, cannabis, cheerful nihilism, cheerful nihilism facebook, martha stewart, snoop dogg, viral facebook posts",,,,,
2,,,,Unknown,Kim LaCapria,,,truthorfiction,https://www.truthorfiction.com/author/kim/,https://www.truthorfiction.com/banana-peel-water-for-plants/,Banana peel water or banana peel tea is superior to water for home gardeners.,2021-07-26,truthorfiction,,"Posted in Fact Checks, Viral ContentTagged bad advice, bad science, banana peel tea, banana peel water, banana peel water for plants, folk cures, folk gardening, Gardening, gardening myths, Pinterest, tiktok, viral facebook posts","https://www.truthorfiction.com/category/fact-checks/,https://www.truthorfiction.com/category/fact-checks/viral-content/,https://www.truthorfiction.com/tag/bad-advice/,https://www.truthorfiction.com/tag/bad-science/,https://www.truthorfiction.com/tag/banana-peel-tea/,https://www.truthorfiction.com/tag/banana-peel-water/,https://www.truthorfiction.com/tag/banana-peel-water-for-plants/,https://www.truthorfiction.com/tag/folk-cures/,https://www.truthorfiction.com/tag/folk-gardening/,https://www.truthorfiction.com/tag/gardening/,https://www.truthorfiction.com/tag/gardening-myths/,https://www.truthorfiction.com/tag/pinterest/,https://www.truthorfiction.com/tag/tiktok/,https://www.truthorfiction.com/tag/viral-facebook-posts/",Banana Peel Water for Plants,"bad advice, bad science, banana peel tea, banana peel water, banana peel water for plants, folk cures, folk gardening, Gardening, gardening myths, Pinterest, tiktok, viral facebook posts",,,,,
3,,,,True,Arturo Garcia,,,truthorfiction,https://www.truthorfiction.com/author/art/,https://www.truthorfiction.com/peyo-horse-hospital/,A French hospital allows terminal patients and patients dealing with cancer to receive visit from a horse named Peyo.,2021-07-26,truthorfiction,,"Posted in Fact Checks, Viral ContentTagged facebook, Hassen Bouchakour, Les Sabots Du Coeur, Peyo, The Guardian, twitter","https://www.truthorfiction.com/category/fact-checks/,https://www.truthorfiction.com/category/fact-checks/viral-content/,https://www.truthorfiction.com/tag/facebook/,https://www.truthorfiction.com/tag/hassen-bouchakour/,https://www.truthorfiction.com/tag/les-sabots-du-coeur/,https://www.truthorfiction.com/tag/peyo/,https://www.truthorfiction.com/tag/the-guardian/,https://www.truthorfiction.com/tag/twitter/",Does a Hospital in France Allow Terminal Patients to Meet With...,"facebook, Hassen Bouchakour, Les Sabots Du Coeur, Peyo, The Guardian, twitter",,,,,
4,,,,Decontextualized,Kim LaCapria,,,truthorfiction,https://www.truthorfiction.com/author/kim/,https://www.truthorfiction.com/rep-jack-kimble-i-find-it-very-suspicious/,"@RepJackKimble (Rep. Jack Kimble) tweeted, ""I find it very suspicious that the virus now all of a sudden seems to be targeting people who didn't get that ridiculous vaccine. Has anybody else noticed this? Hmm, why is the virus only targeting those who stand up to government vaccination all of a sudden?""",2021-07-23,truthorfiction,,"Posted in Disinformation, Fact ChecksTagged @repjackkimble, decontextualized, out of context, parody, rep jack kimble, satire, satirical twitter, viral facebook posts, viral tweets","https://www.truthorfiction.com/category/fact-checks/disinformation/,https://www.truthorfiction.com/category/fact-checks/,https://www.truthorfiction.com/tag/repjackkimble/,https://www.truthorfiction.com/tag/decontextualized/,https://www.truthorfiction.com/tag/out-of-context/,https://www.truthorfiction.com/tag/parody/,https://www.truthorfiction.com/tag/rep-jack-kimble/,https://www.truthorfiction.com/tag/satire/,https://www.truthorfiction.com/tag/satirical-twitter/,https://www.truthorfiction.com/tag/viral-facebook-posts/,https://www.truthorfiction.com/tag/viral-tweets/",Rep. Jack Kimble: ‘I Find It Very Suspicious …’,"@repjackkimble, decontextualized, out of context, parody, rep jack kimble, satire, satirical twitter, viral facebook posts, viral tweets",,,,,
5,,,,Decontextualized,Kim LaCapria,,,truthorfiction,https://www.truthorfiction.com/author/kim/,https://www.truthorfiction.com/catholic-leader-who-wanted-to-deny-biden-communion-resigns-after-caught-using-gay-dating-app/,"A ""Catholic leader who wanted to deny Biden communion"" resigned after he was caught using a dating app.",2021-07-22,truthorfiction,,"Posted in Fact Checks, PoliticsTagged biden, biden communion, catholic, catholic church, church scandals, grindr, misleading, monsignor burrill, speculation, viral facebook posts","https://www.truthorfiction.com/category/fact-checks/,https://www.truthorfiction.com/category/fact-checks/politics/,https://www.truthorfiction.com/tag/biden/,https://www.truthorfiction.com/tag/biden-communion/,https://www.truthorfiction.com/tag/catholic/,https://www.truthorfiction.com/tag/catholic-church/,https://www.truthorfiction.com/tag/church-scandals/,https://www.truthorfiction.com/tag/grindr/,https://www.truthorfiction.com/tag/misleading/,https://www.truthorfiction.com/tag/monsignor-burrill/,https://www.truthorfiction.com/tag/speculation/,https://www.truthorfiction.com/tag/viral-facebook-posts/",‘Catholic Leader Who Wanted to Deny Biden Communion Resigns After...,"biden, biden communion, catholic, catholic church, church scandals, grindr, misleading, monsignor burrill, speculation, viral facebook posts",,,,,
6,,,,Decontextualized,Kim LaCapria,,,truthorfiction,https://www.truthorfiction.com/author/kim/,https://www.truthorfiction.com/doc-and-marty-made-it-to-2021/,"""Doc and Marty made it to 2021.""",2021-07-22,truthorfiction,,"Posted in Fact Checks, Viral ContentTagged back to the future, decontextualized, doc and marty made it to 2021, imgur, instagram, reddit comments, viral facebook posts, viral reddit posts","https://www.truthorfiction.com/category/fact-checks/,https://www.truthorfiction.com/category/fact-checks/viral-content/,https://www.truthorfiction.com/tag/back-to-the-future/,https://www.truthorfiction.com/tag/decontextualized/,https://www.truthorfiction.com/tag/doc-and-marty-made-it-to-2021/,https://www.truthorfiction.com/tag/imgur/,https://www.truthorfiction.com/tag/instagram/,https://www.truthorfiction.com/tag/reddit-comments/,https://www.truthorfiction.com/tag/viral-facebook-posts/,https://www.truthorfiction.com/tag/viral-reddit-posts/",‘Doc and Marty Made it to 2021’,"back to the future, decontextualized, doc and marty made it to 2021, imgur, instagram, reddit comments, viral facebook posts, viral reddit posts",,,,,
7,,,,Decontextualized,Kim LaCapria,,,truthorfiction,https://www.truthorfiction.com/author/kim/,https://www.truthorfiction.com/in-tthe-cayman-islands-there-is-a-modest-five-story-building-that-is-home-to-18857-companies/,"""In the Cayman Islands, there is a modest five-story building that is home to 18,857 companies.""",2021-07-21,truthorfiction,,"Posted in Fact Checks, PoliticsTagged barack obama, bernie sanders, cayman islands, imgur, mitt romney, ro khanna, tax evasion, tax shelter, viral tweets","https://www.truthorfiction.com/category/fact-checks/,https://www.truthorfiction.com/category/fact-checks/politics/,https://www.truthorfiction.com/tag/barack-obama/,https://www.truthorfiction.com/tag/bernie-sanders/,https://www.truthorfiction.com/tag/cayman-islands/,https://www.truthorfiction.com/tag/imgur/,https://www.truthorfiction.com/tag/mitt-romney/,https://www.truthorfiction.com/tag/ro-khanna/,https://www.truthorfiction.com/tag/tax-evasion/,https://www.truthorfiction.com/tag/tax-shelter/,https://www.truthorfiction.com/tag/viral-tweets/","‘In the Cayman Islands, There Is a Modest Five-Story Building That...","barack obama, bernie sanders, cayman islands, imgur, mitt romney, ro khanna, tax evasion, tax shelter, viral tweets",,,,,
8,,,,True,Kim LaCapria,,,truthorfiction,https://www.truthorfiction.com/author/kim/,https://www.truthorfiction.com/abraham-lincoln-and-the-samurai-fax-machine/,"""There was a 22 year window in which a samurai could have sent a fax to Abraham Lincoln.""",2021-07-21,truthorfiction,,"Posted in Fact Checks, Viral ContentTagged abraham lincoln, abraham lincoln samurai fax machine, fax machine, samurai, samurai sending a fax to abraham lincoln, technically true, viral facebook posts","https://www.truthorfiction.com/category/fact-checks/,https://www.truthorfiction.com/category/fact-checks/viral-content/,https://www.truthorfiction.com/tag/abraham-lincoln/,https://www.truthorfiction.com/tag/abraham-lincoln-samurai-fax-machine/,https://www.truthorfiction.com/tag/fax-machine/,https://www.truthorfiction.com/tag/samurai/,https://www.truthorfiction.com/tag/samurai-sending-a-fax-to-abraham-lincoln/,https://www.truthorfiction.com/tag/technically-true/,https://www.truthorfiction.com/tag/viral-facebook-posts/",Abraham Lincoln and the Samurai Fax Machine,"abraham lincoln, abraham lincoln samurai fax machine, fax machine, samurai, samurai sending a fax to abraham lincoln, technically true, viral facebook posts",,,,,
9,,,,True,Kim LaCapria,,,truthorfiction,https://www.truthorfiction.com/author/kim/,https://www.truthorfiction.com/snapchat-plant-identifier/,"""If you focus your Snapchat camera on ANY plant & hold the screen it will tell you EXACTLY what that plant is.. DOPE. THE PEOPLE NEED TO KNOW THIS‼️🌳☘️🌵🌿🪴 (or maybe everyone already knew this & I’m just late & easily amused 🤔) PS: WORKS ON DOG BREEDS ALSO ‼️🤯""",2021-07-20,truthorfiction,,"Posted in Fact Checks, Viral ContentTagged dog scanner, plantsnap, snapchat, snapchat plant identifier, snapchat plants, viral facebook posts","https://www.truthorfiction.com/category/fact-checks/,https://www.truthorfiction.com/category/fact-checks/viral-content/,https://www.truthorfiction.com/tag/dog-scanner/,https://www.truthorfiction.com/tag/plantsnap/,https://www.truthorfiction.com/tag/snapchat/,https://www.truthorfiction.com/tag/snapchat-plant-identifier/,https://www.truthorfiction.com/tag/snapchat-plants/,https://www.truthorfiction.com/tag/viral-facebook-posts/",Snapchat Plant Identifier,"dog scanner, plantsnap, snapchat, snapchat plant identifier, snapchat plants, viral facebook posts",,,,,
10,,,,True,Kim LaCapria,,,truthorfiction,https://www.truthorfiction.com/author/kim/,https://www.truthorfiction.com/this-wenche-thikke/,"A Tumblr post includes an accurate excerpt from Canterbury Tales, including ""this wenche thikke"" and ""[I will not lie.]""",2021-07-20,truthorfiction,,"Posted in Fact Checks, Viral ContentTagged canterbury tales, history memes, Tumblr, viral facebook posts, wenche thikke","https://www.truthorfiction.com/category/fact-checks/,https://www.truthorfiction.com/category/fact-checks/viral-content/,https://www.truthorfiction.com/tag/canterbury-tales/,https://www.truthorfiction.com/tag/history-memes/,https://www.truthorfiction.com/tag/tumblr/,https://www.truthorfiction.com/tag/viral-facebook-posts/,https://www.truthorfiction.com/tag/wenche-thikke/",‘This Wenche Thikke’,"canterbury tales, history memes, Tumblr, viral facebook posts, wenche thikke",,,,,
11,,,,Decontextualized,Kim LaCapria,,,truthorfiction,https://www.truthorfiction.com/author/kim/,https://www.truthorfiction.com/rep-matt-gaetz-says-if-democrats-pass-voting-bill-republicans-will-never-win-another-election/,"In July 2021, Rep. Matt Gaetz said if Democrats passed a voting rights bill, no Republicans would ever win an election again.",2021-07-19,truthorfiction,,"Posted in Disinformation, Fact ChecksTagged for the people act, matt gaetz, matt gaetz republicans will never win another election, Rep. Matt Gaetz, viral facebook posts, viral tweets","https://www.truthorfiction.com/category/fact-checks/disinformation/,https://www.truthorfiction.com/category/fact-checks/,https://www.truthorfiction.com/tag/for-the-people-act/,https://www.truthorfiction.com/tag/matt-gaetz/,https://www.truthorfiction.com/tag/matt-gaetz-republicans-will-never-win-another-election/,https://www.truthorfiction.com/tag/rep-matt-gaetz/,https://www.truthorfiction.com/tag/viral-facebook-posts/,https://www.truthorfiction.com/tag/viral-tweets/","Rep. Matt Gaetz Says if Democrats Pass Voting Bill, Republicans...","for the people act, matt gaetz, matt gaetz republicans will never win another election, Rep. Matt Gaetz, viral facebook posts, viral tweets",,,,,
12,,,,True,Kim LaCapria,,,truthorfiction,https://www.truthorfiction.com/author/kim/,https://www.truthorfiction.com/hundreds-of-cars-are-lined-up-along-hwy-18-into-mission-south-dakota-as-the-remains-of-native-children-were-returned-to-their-homelands/,"On July 16 2021, ""hundreds of cars lined up along Hwy 18 into Mission, South Dakota as the remains of Native children were returned to their homelands.""",2021-07-19,truthorfiction,,"Posted in Fact Checks, Viral ContentTagged caravan for native children, residential school scandal, residential schools in the US, rosebud sioux children, sicangu, viral facebook posts, viral tweets","https://www.truthorfiction.com/category/fact-checks/,https://www.truthorfiction.com/category/fact-checks/viral-content/,https://www.truthorfiction.com/tag/caravan-for-native-children/,https://www.truthorfiction.com/tag/residential-school-scandal/,https://www.truthorfiction.com/tag/residential-schools-in-the-us/,https://www.truthorfiction.com/tag/rosebud-sioux-children/,https://www.truthorfiction.com/tag/sicangu/,https://www.truthorfiction.com/tag/viral-facebook-posts/,https://www.truthorfiction.com/tag/viral-tweets/","‘Hundreds of Cars Are Lined Up Along Hwy 18 Into Mission, South...","caravan for native children, residential school scandal, residential schools in the US, rosebud sioux children, sicangu, viral facebook posts, viral tweets",,,,,
13,,,,Not True,Kim LaCapria,,,truthorfiction,https://www.truthorfiction.com/author/kim/,https://www.truthorfiction.com/canadian-peanut-butter-packaging/,Image shows Canadian peanut butter sold in a styrofoam tray.,2021-07-16,truthorfiction,,"Posted in Fact Checks, Viral ContentTagged amish peanut butter, canadian peanut butter, canadian peanut butter packaging, deleted tweets, miscaptioned, mislabeled, out of context, viral facebook posts, viral images, viral reddit posts, viral tweets, why is canadian milk in bags","https://www.truthorfiction.com/category/fact-checks/,https://www.truthorfiction.com/category/fact-checks/viral-content/,https://www.truthorfiction.com/tag/amish-peanut-butter/,https://www.truthorfiction.com/tag/canadian-peanut-butter/,https://www.truthorfiction.com/tag/canadian-peanut-butter-packaging/,https://www.truthorfiction.com/tag/deleted-tweets/,https://www.truthorfiction.com/tag/miscaptioned/,https://www.truthorfiction.com/tag/mislabeled/,https://www.truthorfiction.com/tag/out-of-context/,https://www.truthorfiction.com/tag/viral-facebook-posts/,https://www.truthorfiction.com/tag/viral-images/,https://www.truthorfiction.com/tag/viral-reddit-posts/,https://www.truthorfiction.com/tag/viral-tweets/,https://www.truthorfiction.com/tag/why-is-canadian-milk-in-bags/",‘Canadian Peanut Butter’ Packaging,"amish peanut butter, canadian peanut butter, canadian peanut butter packaging, deleted tweets, miscaptioned, mislabeled, out of context, viral facebook posts, viral images, viral reddit posts, viral tweets, why is canadian milk in bags",,,,,
14,,,,True,Kim LaCapria,,,truthorfiction,https://www.truthorfiction.com/author/kim/,https://www.truthorfiction.com/captain-america-31-years-ago/,"A comic from 1990 contradicts actor Dean Cain's complaint about a newly ""woke"" Captain America.",2021-07-16,truthorfiction,,"Posted in Fact Checks, Viral ContentTagged art out of context, captain america, captain america 31 years ago, daredevil 283, dean cain, drug war, imgur, latin america, viral clapbacks, viral tweets","https://www.truthorfiction.com/category/fact-checks/,https://www.truthorfiction.com/category/fact-checks/viral-content/,https://www.truthorfiction.com/tag/art-out-of-context/,https://www.truthorfiction.com/tag/captain-america/,https://www.truthorfiction.com/tag/captain-america-31-years-ago/,https://www.truthorfiction.com/tag/daredevil-283/,https://www.truthorfiction.com/tag/dean-cain/,https://www.truthorfiction.com/tag/drug-war/,https://www.truthorfiction.com/tag/imgur/,https://www.truthorfiction.com/tag/latin-america/,https://www.truthorfiction.com/tag/viral-clapbacks/,https://www.truthorfiction.com/tag/viral-tweets/",‘Captain America 31 Years Ago’,"art out of context, captain america, captain america 31 years ago, daredevil 283, dean cain, drug war, imgur, latin america, viral clapbacks, viral tweets",,,,,
15,,,,True,Kim LaCapria,,,truthorfiction,https://www.truthorfiction.com/author/kim/,https://www.truthorfiction.com/were-cooks-the-largest-occupational-group-to-die-in-the-pandemic/,"""I wish Anthony Bourdain were alive today to articulate the insanity of living in a country where cooks were the largest occupational group to die in a pandemic and restaurant owners are pouting that nobody wants to work in restaurants anymore.""",2021-07-15,truthorfiction,,"Posted in Fact Checks, Viral ContentTagged anthony bourdain, cooks excess mortality, excess mortality, imgur, largest occupational group to die cooks, ucsf, viral tweets","https://www.truthorfiction.com/category/fact-checks/,https://www.truthorfiction.com/category/fact-checks/viral-content/,https://www.truthorfiction.com/tag/anthony-bourdain/,https://www.truthorfiction.com/tag/cooks-excess-mortality/,https://www.truthorfiction.com/tag/excess-mortality/,https://www.truthorfiction.com/tag/imgur/,https://www.truthorfiction.com/tag/largest-occupational-group-to-die-cooks/,https://www.truthorfiction.com/tag/ucsf/,https://www.truthorfiction.com/tag/viral-tweets/",Were Cooks the Largest Occupational Group to Die in the Pandemic?,"anthony bourdain, cooks excess mortality, excess mortality, imgur, largest occupational group to die cooks, ucsf, viral tweets",,,,,
16,,,,Decontextualized,Kim LaCapria,,,truthorfiction,https://www.truthorfiction.com/author/kim/,https://www.truthorfiction.com/this-picture-was-taken-in-1925-of-a-girl-visiting-her-twin-sisters-grave/,"""This picture was taken in 1925. Its of a girl visiting her twin sisters grave. The twin sister had died the previous year in a house fire. Parents saw her many times talking and playing with her twin sister after she has passed away. They thought it was just part of the grieving process, that is until this was developed.""",2021-07-15,truthorfiction,,"Posted in Disinformation, Fact ChecksTagged after death communication, afterlife, art out of context, creepy images, ghost, imgur, viral facebook posts","https://www.truthorfiction.com/category/fact-checks/disinformation/,https://www.truthorfiction.com/category/fact-checks/,https://www.truthorfiction.com/tag/after-death-communication/,https://www.truthorfiction.com/tag/afterlife/,https://www.truthorfiction.com/tag/art-out-of-context/,https://www.truthorfiction.com/tag/creepy-images/,https://www.truthorfiction.com/tag/ghost/,https://www.truthorfiction.com/tag/imgur/,https://www.truthorfiction.com/tag/viral-facebook-posts/","‘This Picture Was Taken in 1925, Of a Girl Visiting Her Twin...","after death communication, afterlife, art out of context, creepy images, ghost, imgur, viral facebook posts",,,,,
17,,,,Decontextualized,Kim LaCapria,,,truthorfiction,https://www.truthorfiction.com/author/kim/,https://www.truthorfiction.com/national-kool-aid-day-2021-and-mike-lindells-trump-return-claim/,"""My Pillow guy Mike Lindell says August 13th [2021] is the date that Donald Trump will be 'reinstated.' Do you know what else is on August 13th? NATIONAL KOOL-AID DAY. For real. It's the second Friday in August every year. You can't make this up.""",2021-07-14,truthorfiction,,"Posted in Disinformation, Fact ChecksTagged august 13 trump reinstated, election conspiracies, imgur, memes, mike lindell, national kool aid day 2021, viral facebook posts, viral tweets","https://www.truthorfiction.com/category/fact-checks/disinformation/,https://www.truthorfiction.com/category/fact-checks/,https://www.truthorfiction.com/tag/august-13-trump-reinstated/,https://www.truthorfiction.com/tag/election-conspiracies/,https://www.truthorfiction.com/tag/imgur/,https://www.truthorfiction.com/tag/memes/,https://www.truthorfiction.com/tag/mike-lindell/,https://www.truthorfiction.com/tag/national-kool-aid-day-2021/,https://www.truthorfiction.com/tag/viral-facebook-posts/,https://www.truthorfiction.com/tag/viral-tweets/",National Kool Aid Day 2021 and Mike Lindell’s ‘Trump Return’ Claim,"august 13 trump reinstated, election conspiracies, imgur, memes, mike lindell, national kool aid day 2021, viral facebook posts, viral tweets",,,,,
18,,,,Decontextualized,Kim LaCapria,,,truthorfiction,https://www.truthorfiction.com/author/kim/,https://www.truthorfiction.com/friendly-roast-in-2015-hrc-being-roasted/,"TikTok videos labeled ""Friendly Roast in 2015"" and ""HRC Being Roasted"" show then-candidate Donald Trump ""roasting"" Hillary Clinton in 2015.",2021-07-14,truthorfiction,,"Posted in Disinformation, Fact ChecksTagged al smith dinner 2016, donald trump, hillary clinton, out of context, roasts, tiktok, viral facebook posts, viral tiktok posts, viral videos","https://www.truthorfiction.com/category/fact-checks/disinformation/,https://www.truthorfiction.com/category/fact-checks/,https://www.truthorfiction.com/tag/al-smith-dinner-2016/,https://www.truthorfiction.com/tag/donald-trump/,https://www.truthorfiction.com/tag/hillary-clinton/,https://www.truthorfiction.com/tag/out-of-context/,https://www.truthorfiction.com/tag/roasts/,https://www.truthorfiction.com/tag/tiktok/,https://www.truthorfiction.com/tag/viral-facebook-posts/,https://www.truthorfiction.com/tag/viral-tiktok-posts/,https://www.truthorfiction.com/tag/viral-videos/","‘Friendly Roast in 2015,’ ‘HRC Being Roasted’","al smith dinner 2016, donald trump, hillary clinton, out of context, roasts, tiktok, viral facebook posts, viral tiktok posts, viral videos",,,,,
19,,,,True,Kim LaCapria,,,truthorfiction,https://www.truthorfiction.com/author/kim/,https://www.truthorfiction.com/jaleel-white-and-purple-urkel/,"Image depicts Jaleel White (the actor who played Steve Urkel on Family Matters) promoting a cannabis strain called ""Purple Urkel"" with Snoop Dogg.",2021-07-13,truthorfiction,,"Posted in Entertainment, Fact ChecksTagged cannabis, jaleel white snoop dogg, purple urkel, snoop dogg, viral facebook posts","https://www.truthorfiction.com/category/fact-checks/entertainment/,https://www.truthorfiction.com/category/fact-checks/,https://www.truthorfiction.com/tag/cannabis/,https://www.truthorfiction.com/tag/jaleel-white-snoop-dogg/,https://www.truthorfiction.com/tag/purple-urkel/,https://www.truthorfiction.com/tag/snoop-dogg/,https://www.truthorfiction.com/tag/viral-facebook-posts/",Jaleel White and ‘Purple Urkel’,"cannabis, jaleel white snoop dogg, purple urkel, snoop dogg, viral facebook posts",,,,,
